{
  "schema_version": 2,
  "release_date": "2026-10-20",
  "sources": [
    {
      "id": "EB",
      "path": "1 Master Academic CV/Evidence_Bank.md",
      "sha256": "e0934cab5a378f9766660b339587188bdcc9d38bcd85c6433817282fec59834f"
    },
    {
      "id": "PUB",
      "path": "4 Publication list/Master_Publication_List.md",
      "sha256": "fc76452713464119758fbe9fdadbd3516f176ad9a5c9bfb8f55370b6a1d45dd9"
    },
    {
      "id": "CONTRIB",
      "path": "4 Publication list/Publication_Contributions.json",
      "sha256": "ae05ab7c15ee1f9a02b834af1b35d18e468bb56b3a604d8f4f488b7675abc876"
    },
    {
      "id": "PROFILE",
      "path": "3 Research Profile/Hao_Yu_Application_Evidence_Wording.md",
      "sha256": "7337f5442b2445d7042c05099bdf983ca63f5a09f015def53682ef441790b9ba"
    },
    {
      "id": "EXPORT",
      "path": "1 Master Academic CV/Current_Export_Record.json",
      "sha256": "90a10f9d7ad7367924d99e484902cfe04e1ac0367f4830c3f6851fd4a6696bc5"
    }
  ],
  "profile": {
    "id": "PERSON",
    "selected": true,
    "name": "Hao Yu",
    "role": "PhD researcher in Engineering",
    "institution": "University of Cambridge",
    "institution_short": "Cambridge",
    "discipline": "Engineering",
    "group": "Hofmann Group",
    "email": "hy377@cam.ac.uk",
    "location": "Cambridge, United Kingdom",
    "provenance": {
      "source": "EB §§1.1,1.2,2.1",
      "evidence_status": "APPLICANT_CONFIRMED",
      "visibility": "PUBLIC",
      "reviewed": "2026-10-05"
    }
  },
  "qualification_events": [
    {
      "id": "THESIS-SUBMITTED",
      "qualification_id": "EDU-CAM",
      "kind": "THESIS_SUBMITTED",
      "date": "2026-09-30",
      "selected": true,
      "provenance": {
        "source": "EB §2.1",
        "evidence_status": "APPLICANT_CONFIRMED",
        "visibility": "PUBLIC",
        "reviewed": "2026-10-05"
      }
    }
  ],
  "links": [
    {
      "id": "LINKEDIN",
      "label": "LinkedIn",
      "url": "https://www.linkedin.com/in/hao-yu-barry",
      "selected": true,
      "provenance": {
        "source": "EB §1.1",
        "evidence_status": "APPLICANT_CONFIRMED",
        "visibility": "PUBLIC",
        "reviewed": "2026-10-05"
      }
    },
    {
      "id": "SCHOLAR",
      "label": "Google Scholar",
      "url": "https://scholar.google.com/citations?user=XgJBN04AAAAJ&hl=en",
      "selected": true,
      "provenance": {
        "source": "EB §1.1",
        "evidence_status": "APPLICANT_CONFIRMED",
        "visibility": "PUBLIC",
        "reviewed": "2026-10-05"
      }
    },
    {
      "id": "ORCID",
      "label": "ORCID",
      "url": "https://orcid.org/0000-0003-1722-7909",
      "selected": true,
      "provenance": {
        "source": "EB §1.1",
        "evidence_status": "APPLICANT_CONFIRMED",
        "visibility": "PUBLIC",
        "reviewed": "2026-10-05"
      }
    },
    {
      "id": "GITHUB",
      "label": "GitHub",
      "url": "https://github.com/barry063",
      "selected": true,
      "provenance": {
        "source": "EB §1.1",
        "evidence_status": "APPLICANT_CONFIRMED",
        "visibility": "PUBLIC",
        "reviewed": "2026-10-05"
      }
    },
    {
      "id": "GROUP",
      "label": "Hofmann Group",
      "url": "https://hofmann-group.eng.cam.ac.uk/",
      "selected": true,
      "provenance": {
        "source": "EB §§1.1,2.1",
        "evidence_status": "APPLICANT_CONFIRMED",
        "visibility": "PUBLIC",
        "reviewed": "2026-10-05"
      }
    }
  ],
  "outputs": [
    {
      "id": "J1",
      "selected": true,
      "provenance": {
        "source": "EB §§3.1,5.1; PUB J1",
        "evidence_status": "VERIFIED",
        "visibility": "PUBLIC",
        "reviewed": "2026-10-05"
      },
      "kind": "ARTICLE",
      "status": "PUBLISHED",
      "title": "A close-space sublimation approach to tungsten oxide and sulfide nanostructure formation",
      "year": 2025,
      "authors": "Hao Yu, Jinfeng Yang, Bernhard Fickl, Shaoliang Guan, Oliver J. Burton, Gwenhivir Wyatt-Moon, Andrew Flewitt, Bernhard C. Bayer and Stephan Hofmann.",
      "venue": "Nanoscale 17(36), 21070–21082.",
      "contribution": "First author. Designed and conducted CSS-CVD growth and Raman/PL measurements; co-wrote the manuscript with Stephan Hofmann.",
      "links": [
        {
          "label": "DOI",
          "url": "https://doi.org/10.1039/D5NR01458A"
        }
      ],
      "cv_authors": "{{profile.name}} et al. (first author)."
    },
    {
      "id": "J2",
      "selected": true,
      "provenance": {
        "source": "EB §§3.4,5.1,7.2.1; PUB J2; CONTRIB J2",
        "evidence_status": "APPLICANT_CONFIRMED",
        "visibility": "PUBLIC",
        "reviewed": "2026-10-20"
      },
      "kind": "ARTICLE",
      "status": "PUBLISHED",
      "title": "Se nanowire crystal formation via oxidation of 2D HfSe₂: A solid-state, in situ reaction coupling for heterogeneous integration technologies",
      "year": 2025,
      "authors": "Sunvir Sahota, Irina Chircă, Oliver J. Burton, Hao Yu, Max Rimmer, Jinfeng Yang, Kyungseo Park, Arthur Summers, Siddika Mertdinc-Ulkuseven, Matthew Lindley, Sarah J. Haigh and Stephan Hofmann.",
      "venue": "ACS Applied Nano Materials 8(15), 7608–7615.",
      "contribution": "Co-author. Raman/SEM acquisition and analysis; SEM imaging on charging-prone substrates.",
      "links": [
        {
          "label": "DOI",
          "url": "https://doi.org/10.1021/acsanm.5c00308"
        }
      ],
      "cv_authors": "Sunvir Sahota et al., including {{profile.name}}."
    },
    {
      "id": "J3",
      "selected": true,
      "provenance": {
        "source": "EB §§3.6,5.1; PUB J3",
        "evidence_status": "VERIFIED",
        "visibility": "PUBLIC",
        "reviewed": "2026-10-05"
      },
      "kind": "ARTICLE",
      "status": "PUBLISHED",
      "title": "Scalable high-precision trimming of photonic resonances by polymer exposure to energetic beams",
      "year": 2023,
      "authors": "Nikolaos Farmakidis, Hao Yu, June Sang Lee, Johannes Feldmann, Mengyun Wang, Yuhan He, Samarth Aggarwal, Bowei Dong, Wolfram H. P. Pernice and Harish Bhaskaran.",
      "venue": "Nano Letters 23(11), 4800–4806.",
      "contribution": "Second author. Measurements, design and simulations. Associated correction: Nano Letters 24(41), 13103–13104 (2024).",
      "links": [
        {
          "label": "DOI",
          "url": "https://doi.org/10.1021/acs.nanolett.3c00220"
        },
        {
          "label": "Correction",
          "url": "https://doi.org/10.1021/acs.nanolett.4c03363"
        }
      ],
      "cv_authors": "Nikolaos Farmakidis, {{profile.name}} et al. (second author)."
    },
    {
      "id": "J4",
      "selected": true,
      "provenance": {
        "source": "EB §5.1; PUB J4",
        "evidence_status": "VERIFIED",
        "visibility": "PUBLIC",
        "reviewed": "2026-10-05"
      },
      "kind": "ARTICLE",
      "status": "PUBLISHED",
      "title": "How do microplastics adsorb metals? A preliminary study under simulated wetland conditions",
      "year": 2022,
      "authors": "Minfei Jian, Jiarui Niu, Wenhua Li, Yuyue Huang, Hao Yu, Zheng Lai, Shuli Liu and Elvis Genbo Xu.",
      "venue": "Chemosphere 309, Part 1, 136547.",
      "contribution": "Co-author. Published CRediT contribution: data analysis.",
      "links": [
        {
          "label": "DOI",
          "url": "https://doi.org/10.1016/j.chemosphere.2022.136547"
        }
      ],
      "cv_authors": "Minfei Jian et al., including {{profile.name}}."
    },
    {
      "id": "S1",
      "selected": true,
      "provenance": {
        "source": "EB §§3.5,5.2; PUB S1",
        "evidence_status": "APPLICANT_CONFIRMED",
        "visibility": "PUBLIC",
        "reviewed": "2026-10-05"
      },
      "kind": "ARTICLE",
      "status": "UNDER_REVIEW",
      "title": "Closed-loop crystal layer writing of atomically thin semiconductor",
      "year": null,
      "authors": null,
      "venue": null,
      "contribution": "Co-authored manuscript. Contribution: Raman/PL measurements and analysis.",
      "links": [],
      "cv_authors": null
    },
    {
      "id": "P1",
      "selected": true,
      "provenance": {
        "source": "EB §§3.2,5.2; PUB P1",
        "evidence_status": "APPLICANT_CONFIRMED",
        "visibility": "PUBLIC",
        "reviewed": "2026-10-05"
      },
      "kind": "ARTICLE",
      "status": "IN_PREPARATION",
      "title": "Salt-assisted close-space growth of monolayer WS₂",
      "year": null,
      "authors": null,
      "venue": null,
      "contribution": "First-author manuscript {{status:P1:lower}} on source–transport–growth relationships. Topic description; final title to follow.",
      "links": [],
      "cv_authors": null
    },
    {
      "id": "SW1",
      "selected": true,
      "provenance": {
        "source": "EB §§3.3,5.3; PUB SW1",
        "evidence_status": "APPLICANT_CONFIRMED",
        "visibility": "PUBLIC",
        "reviewed": "2026-10-05"
      },
      "kind": "SOFTWARE",
      "status": "RESEARCH_SOFTWARE",
      "title": "RamanPL_2D",
      "year": null,
      "authors": null,
      "venue": null,
      "contribution": "Python toolkit for Raman/PL preprocessing, peak fitting, spatial mapping, batch workflows and metadata-aware export. BSD 3-Clause License.",
      "links": [
        {
          "label": "GitHub repository",
          "url": "https://github.com/barry063/RamanPL_2D"
        }
      ],
      "cv_authors": null
    }
  ],
  "experience": [
    {
      "id": "EXP-INNO",
      "selected": true,
      "provenance": {
        "source": "EB §4.1",
        "evidence_status": "APPLICANT_CONFIRMED",
        "visibility": "PUBLIC",
        "reviewed": "2026-10-05"
      },
      "text": [
        "Completed the Little Angel Programme, with experience in early-stage deep-tech investment, sector research and technology assessment.",